searchTerm,title,description,canonical,promotionalText,delete
vasos,Diversidade em Vasos de Cerâmica - Sodimac,"Vaso de cerâmica, vaso autoirrigável e outros vasos para sua casa e jardim. Decore a sua casa com a Sodimac. Os melhores preços aqui. Compre online!",https://www.sodimac.com.br/sodimac-br/category/cat660012/vasos/,"<h2>Vasos para sua Casa ou Jardim</h2>Vaso de cerâmica, vaso autoirrigável e outros vasos para casa e jardim. Decore a sua casa com a Sodimac. Os melhores preços estão no site. Compre online!",false
marca-propria,"Marcas Próprias: Ferramentas, Móveis e Mais - Sodimac","Descubra a qualidade das marcas próprias da Sodimac. Ferramentas, móveis, decoração e mais produtos para casa e construção. Confira!",https://www.sodimac.com.br/sodimac-br/category/cat2160062/marca-propria/,"<h2>Sodimac Marcas Próprias: Inovação e Qualidade para Sua Casa</h2>Explore nossas marcas próprias na Sodimac, oferecendo uma variedade de produtos, desde ferramentas e móveis até decoração. Confie na qualidade e inovação que só a Sodimac pode oferecer para transformar sua casa com confiança.",false
ventiladores-de-teto-e-parede,Ventiladores de Teto e Parede | Sodimac Brasil,"Compre ventiladores de teto e parede das marcas Aliseu, Ventisol, Spirit e Britânia. Conforto, economia e eficiência na Sodimac!",https://www.sodimac.com.br/sodimac-br/category/cat2240034/ventiladores-de-teto-e-parede/,"<h2>Ventiladores de Teto e Parede: Escolha o Ideal para Você</h2>Escolher o ventilador certo faz toda a diferença na hora de garantir conforto e eficiência em qualquer ambiente. Seja para refrescar sua sala de estar, quarto ou escritório, existem opções perfeitas para cada necessidade. Confira algumas dicas para encontrar o modelo ideal!<br><br>Principais Marcas de Ventiladores<br><br>Na Sodimac, você encontra ventiladores das marcas mais confiáveis do mercado:<br><br>Aliseu: Design moderno e eficiência energética.<br>Ventisol: Modelos acessíveis e versáteis para diversos ambientes.<br>Spirit: Estilo inovador e alta durabilidade.<br>Britânia: Opções práticas com bom custo-benefício.<br>Características-Chave para Escolher o Ventilador Ideal<br>Tamanho e Potência: Ventiladores de teto são ideais para áreas maiores, enquanto os de parede funcionam bem em espaços compactos.<br>Consumo de Energia: Modelos com selo Procel A, como os da Aliseu, garantem economia na conta de luz.<br>Níveis de Velocidade: Prefira opções com controle de velocidades ajustáveis para maior conforto.<br>Facilidade de Instalação: Ventiladores da Spirit e Britânia são conhecidos pela montagem simplificada.<br>Durabilidade: Ventisol oferece modelos robustos, ideais para uso contínuo.<br>FAQ<br><br>Qual a diferença entre ventilador de teto e de parede?<br><br>Ventiladores de teto são mais potentes e cobrem áreas maiores, enquanto os de parede são compactos e direcionam o fluxo de ar para pontos específicos.<br><br>Qual o melhor ventilador para economizar energia?<br><br>Modelos com selo Procel A, como os da Aliseu, são os mais indicados para economia de energia.<br><br>Como escolher o tamanho ideal do ventilador?<br><br>Para ambientes até 20m², opte por ventiladores com pás de 90 a 120 cm. Para áreas maiores, escolha pás acima de 120 cm.<br><br>Ventiladores de parede são fáceis de instalar?<br><br>Sim, especialmente os modelos da Ventisol, que acompanham kits de instalação prática.<br><br>Dicas para Escolher o Melhor Ventilador<br>Considere o Ambiente: Para salas e quartos, ventiladores de teto são mais eficientes. Em cozinhas ou escritórios, os de parede são mais práticos.<br>Verifique Avaliações: Clientes destacam a durabilidade dos modelos da Ventisol e o design dos ventiladores Spirit.<br>Atenção ao Ruído: Modelos com motores silenciosos, como os da Aliseu, são ideais para quartos.<br><br>Encontre o ventilador perfeito para sua casa na Sodimac. Explore nossa seleção de ventiladores de teto e parede das melhores marcas e aproveite conforto e eficiência.",false
caixa-ferramenta-e-chave-de-fenda,Caixa Ferramenta e Chave de Fenda - Sodimac Brazil,Comprar Caixa Ferramenta e Chave de Fenda em promoção na Sodimac. Aqui você encontra diversos tipos de modelos de qualidade para o seu lar. Clique e confira!,https://www.sodimac.com.br/sodimac-br/category/cat2160070/caixa-ferramenta-e-chave-de-fenda/,<h2>Caixa Ferramenta e Chave de Fenda</h2>Encontre em Sodimac Brasil as melhores ofertas em Caixa Ferramenta e Chave de Fenda. Compre Online as melhores marcas de Caixa Ferramenta e Chave de Fenda que você está procurando.<br><br>Tramontina<br><br>Temos Caixa Ferramenta e Chave de Fenda nas principais cidades do Brasil.,false
ceramica,Cerâmica - Sodimac Brazil,Comprar Cerâmica em promoção na Sodimac. Aqui você encontra diversos tipos de modelos de qualidade para o seu lar. Clique e confira!,https://www.sodimac.com.br/sodimac-br/category/cat170718/ceramica/,<h2>Cerâmica</h2>Encontre em Sodimac Brasil as melhores ofertas em Cerâmica. Compre Online as melhores marcas de Cerâmica que você está procurando.<br><br>Just Home Collection<br>Formigres<br>Cerâmica Guarani<br>Portobello<br>Incopisos<br>Eliane<br>Elizabeth<br>Triunfo<br>Ceral<br>Cecafi<br><br>Temos Cerâmica nas principais cidades do Brasil.,false